-Knowledge, Spells {Command, Identify}, Blessings of Knowledge
Life, Spells {Bless, Cure Wounds}, Disciple of life, Heavy armor
Light, Spells {Burning Hands, Faerie Fire}, Warding Flare, Light cantrip
Nature, Spells {Animal Friendship, Speak with Animals}, Acolyte of Nature, Heavy armor
Tempest, Spells {Fog Cloud, Thunderwave}, Wrath of the Storm, Heavy armor
Trickery, Spells {Charm Person, Disguise Self}, Blessing of the Trickster
War, Spells {Divine Favor, Shield of Faith}, War Priest, Heavy armor
